{
  "schema_version": "1.0",
  "speaker_id": "character_07",
  "display_name": "Kurdish Speaker 07 (Male Crisp)",
  "consent_record": "consent/consent.json",
  "canonical_audio_manifest": "canonical/canonical.jsonl",
  "canonical_audio_sha256": [
    "a0aab2ba5c3a51b1dac08798f59b987aad3e88d9ed1fa11ec38665aeeb8f2f73"
  ],
  "profile_embedding_path": "embedding/profile.npy",
  "profile_embedding_sha256": "aab1fb43863cd77b0c3b56c9ecf76aee148a269e943acb64d0ef7938c85c72de",
  "f0_statistics": {
    "median_hz": 140.0,
    "p05_hz": 105.0,
    "p95_hz": 190.0
  },
  "training_split_id": "restore-corpus-v1",
  "adapter": null,
  "created_by_commit": "2b93176",
  "notes": "Verified Kurdish character profile with extracted acoustic prototype vector"
}