{
  "schema_version": "1.0",
  "speaker_id": "character_06",
  "display_name": "Kurdish Speaker 06 (Female Mezzo)",
  "consent_record": "consent/consent.json",
  "canonical_audio_manifest": "canonical/canonical.jsonl",
  "canonical_audio_sha256": [
    "a1dbb8841ab2b3de4ff37228771787ec0da63912b4086b34e63fcc907b62ecbb"
  ],
  "profile_embedding_path": "embedding/profile.npy",
  "profile_embedding_sha256": "3212713df82d9b3a63ce7dbd4903a47487ac24bd12af3d1533b0910c407842d3",
  "f0_statistics": {
    "median_hz": 225.0,
    "p05_hz": 185.0,
    "p95_hz": 285.0
  },
  "training_split_id": "restore-corpus-v1",
  "adapter": null,
  "created_by_commit": "2b93176",
  "notes": "Synthetic development fixture: formant-filtered pulse train generated by research/restoration/profiles_builder.py; no human speaker exists. The embedding is the extracted acoustic prototype vector of the synthetic audio."
}