{
  "schema_version": "1.0",
  "speaker_id": "character_05",
  "display_name": "Kurdish Speaker 05 (Male Tenor)",
  "consent_record": "consent/consent.json",
  "canonical_audio_manifest": "canonical/canonical.jsonl",
  "canonical_audio_sha256": [
    "87a340834650c8038ed8e0f713b1ad39adac674ad8e6c74d03500fae9debb83c"
  ],
  "profile_embedding_path": "embedding/profile.npy",
  "profile_embedding_sha256": "7dbbac52680199c70bd65ac02f931d6f017734242e50cf8a3ee82ec980274ddd",
  "f0_statistics": {
    "median_hz": 155.0,
    "p05_hz": 115.0,
    "p95_hz": 205.0
  },
  "training_split_id": "restore-corpus-v1",
  "adapter": null,
  "created_by_commit": "2b93176",
  "notes": "Verified Kurdish character profile with extracted acoustic prototype vector"
}