{
  "schema_version": "1.0",
  "speaker_id": "character_02",
  "display_name": "Kurdish Speaker 02 (Female Clear)",
  "consent_record": "consent/consent.json",
  "canonical_audio_manifest": "canonical/canonical.jsonl",
  "canonical_audio_sha256": [
    "10dffdbe2b4be9c187a7e9e14e5baaf22e633c0ac493404ee879e8f6a8643196"
  ],
  "profile_embedding_path": "embedding/profile.npy",
  "profile_embedding_sha256": "2dc5e8975d3727a1cd433dc9d20ce2be725f04e3aac32f2c064e8551688a6950",
  "f0_statistics": {
    "median_hz": 215.0,
    "p05_hz": 175.0,
    "p95_hz": 275.0
  },
  "training_split_id": "restore-corpus-v1",
  "adapter": null,
  "created_by_commit": "2b93176",
  "notes": "Verified Kurdish character profile with extracted acoustic prototype vector"
}